{
  "$schema": "https://json-schema.org/draft/2020-12/schema",
  "$id": "https://design-builder.local/schemas/generation_result.schema.json",
  "title": "Generation Result",
  "type": "object",
  "additionalProperties": false,
  "required": [
    "schema_version",
    "generation_id",
    "project_id",
    "run_id",
    "request_ref",
    "final_frame_spec_ref",
    "provider",
    "model",
    "generation_mode",
    "status",
    "outputs",
    "provider_metadata",
    "timing",
    "usage",
    "warnings",
    "errors",
    "provenance",
    "trace"
  ],
  "properties": {
    "schema_version": {
      "const": "1.0.0"
    },
    "generation_id": {
      "$ref": "#/$defs/id"
    },
    "project_id": {
      "$ref": "#/$defs/id"
    },
    "run_id": {
      "$ref": "#/$defs/id"
    },
    "request_ref": {
      "$ref": "#/$defs/artifact_ref"
    },
    "final_frame_spec_ref": {
      "$ref": "#/$defs/artifact_ref"
    },
    "provider": {
      "$ref": "#/$defs/provider"
    },
    "model": {
      "$ref": "#/$defs/model"
    },
    "generation_mode": {
      "enum": [
        "GENERATE",
        "EDIT",
        "REGENERATE",
        "VARIANT"
      ]
    },
    "status": {
      "enum": [
        "PENDING",
        "SUCCEEDED",
        "PARTIALLY_SUCCEEDED",
        "FAILED",
        "BLOCKED"
      ]
    },
    "outputs": {
      "type": "array",
      "items": {
        "$ref": "#/$defs/output"
      }
    },
    "provider_metadata": {
      "type": "object",
      "additionalProperties": true,
      "properties": {
        "provider_request_id": {
          "type": "string"
        },
        "provider_generation_id": {
          "type": "string"
        },
        "raw_status": {
          "type": "string"
        },
        "model_name": {
          "type": "string"
        },
        "response_metadata": {
          "type": "object",
          "additionalProperties": true
        }
      }
    },
    "timing": {
      "$ref": "#/$defs/timing"
    },
    "usage": {
      "type": "object",
      "additionalProperties": true,
      "properties": {
        "cost": {
          "type": [
            "number",
            "null"
          ],
          "minimum": 0
        },
        "credits": {
          "type": [
            "number",
            "null"
          ],
          "minimum": 0
        },
        "units": {
          "type": [
            "number",
            "null"
          ],
          "minimum": 0
        },
        "currency": {
          "type": [
            "string",
            "null"
          ]
        },
        "processing_metrics": {
          "type": "object",
          "additionalProperties": true
        }
      }
    },
    "warnings": {
      "type": "array",
      "items": {
        "$ref": "#/$defs/diagnostic"
      }
    },
    "errors": {
      "type": "array",
      "items": {
        "$ref": "#/$defs/diagnostic"
      }
    },
    "provenance": {
      "$ref": "#/$defs/provenance"
    },
    "trace": {
      "$ref": "#/$defs/trace"
    }
  },
  "$defs": {
    "id": {
      "type": "string",
      "minLength": 1,
      "pattern": "^[A-Za-z0-9._-]+$"
    },
    "artifact_ref": {
      "type": "object",
      "additionalProperties": false,
      "required": [
        "artifact_id",
        "artifact_version"
      ],
      "properties": {
        "artifact_id": {
          "$ref": "#/$defs/id"
        },
        "artifact_version": {
          "type": "string",
          "minLength": 1
        },
        "artifact_uri": {
          "type": "string",
          "minLength": 1
        },
        "checksum": {
          "type": "string",
          "minLength": 1
        }
      }
    },
    "provider": {
      "type": "object",
      "additionalProperties": false,
      "required": [
        "provider_id",
        "provider_type",
        "configured",
        "protocol_status"
      ],
      "properties": {
        "provider_id": {
          "type": "string",
          "minLength": 1
        },
        "provider_type": {
          "enum": [
            "MOCK",
            "THIRD_PARTY",
            "OTHER"
          ]
        },
        "configured": {
          "type": "boolean"
        },
        "protocol_status": {
          "enum": [
            "MOCK",
            "NOT_CONFIGURED",
            "CONFIGURED"
          ]
        }
      }
    },
    "model": {
      "type": "object",
      "additionalProperties": false,
      "required": [
        "family",
        "name"
      ],
      "properties": {
        "family": {
          "const": "NANO_BANANA"
        },
        "name": {
          "type": "string",
          "minLength": 1
        }
      }
    },
    "output": {
      "type": "object",
      "additionalProperties": false,
      "required": [
        "output_id",
        "type",
        "uri",
        "mime_type",
        "index",
        "metadata"
      ],
      "properties": {
        "output_id": {
          "$ref": "#/$defs/id"
        },
        "type": {
          "const": "IMAGE"
        },
        "uri": {
          "type": "string",
          "minLength": 1
        },
        "mime_type": {
          "type": "string",
          "pattern": "^image/"
        },
        "width": {
          "type": [
            "integer",
            "null"
          ],
          "minimum": 1
        },
        "height": {
          "type": [
            "integer",
            "null"
          ],
          "minimum": 1
        },
        "aspect_ratio": {
          "type": [
            "string",
            "null"
          ],
          "pattern": "^[^:]+:[^:]+$"
        },
        "index": {
          "type": "integer",
          "minimum": 0
        },
        "checksum": {
          "type": "string",
          "minLength": 1
        },
        "provider_asset_id": {
          "type": "string",
          "minLength": 1
        },
        "metadata": {
          "type": "object",
          "additionalProperties": true
        }
      }
    },
    "nullable_date": {
      "anyOf": [
        {
          "type": "string",
          "format": "date-time"
        },
        {
          "type": "null"
        }
      ]
    },
    "timing": {
      "type": "object",
      "additionalProperties": false,
      "required": [
        "requested_at",
        "started_at",
        "completed_at",
        "duration_ms"
      ],
      "properties": {
        "requested_at": {
          "$ref": "#/$defs/nullable_date"
        },
        "started_at": {
          "$ref": "#/$defs/nullable_date"
        },
        "completed_at": {
          "$ref": "#/$defs/nullable_date"
        },
        "duration_ms": {
          "type": [
            "integer",
            "null"
          ],
          "minimum": 0
        }
      }
    },
    "diagnostic": {
      "type": "object",
      "additionalProperties": false,
      "required": [
        "code",
        "message",
        "severity",
        "source"
      ],
      "properties": {
        "code": {
          "type": "string",
          "minLength": 1
        },
        "message": {
          "type": "string",
          "minLength": 1
        },
        "severity": {
          "enum": [
            "INFO",
            "WARNING",
            "ERROR"
          ]
        },
        "source": {
          "enum": [
            "ADAPTER",
            "TRANSPORT",
            "PROVIDER",
            "NORMALIZER",
            "PERSISTENCE",
            "SYSTEM"
          ]
        },
        "retryable": {
          "type": "boolean"
        },
        "details": {
          "type": "object",
          "additionalProperties": true
        }
      }
    },
    "provenance": {
      "type": "object",
      "additionalProperties": false,
      "required": [
        "producer",
        "producer_version",
        "created_at",
        "sources"
      ],
      "properties": {
        "producer": {
          "const": "GENERATION_SERVICE"
        },
        "producer_version": {
          "type": "string",
          "minLength": 1
        },
        "created_at": {
          "type": "string",
          "format": "date-time"
        },
        "sources": {
          "type": "array",
          "minItems": 1,
          "uniqueItems": true,
          "items": {
            "type": "string",
            "minLength": 1
          }
        }
      }
    },
    "trace": {
      "type": "object",
      "additionalProperties": false,
      "required": [
        "adapter_id",
        "transport_id",
        "semantic_request_id",
        "creative_authority",
        "provider_configured"
      ],
      "properties": {
        "adapter_id": {
          "type": "string",
          "minLength": 1
        },
        "transport_id": {
          "type": "string",
          "minLength": 1
        },
        "semantic_request_id": {
          "$ref": "#/$defs/id"
        },
        "creative_authority": {
          "const": "NONE"
        },
        "provider_configured": {
          "type": "boolean"
        }
      }
    }
  },
  "allOf": [
    {
      "if": {
        "properties": {
          "status": {
            "const": "SUCCEEDED"
          }
        },
        "required": [
          "status"
        ]
      },
      "then": {
        "properties": {
          "outputs": {
            "minItems": 1
          },
          "errors": {
            "maxItems": 0
          }
        }
      }
    },
    {
      "if": {
        "properties": {
          "status": {
            "const": "PARTIALLY_SUCCEEDED"
          }
        },
        "required": [
          "status"
        ]
      },
      "then": {
        "properties": {
          "outputs": {
            "minItems": 1
          },
          "warnings": {
            "minItems": 1
          }
        }
      }
    },
    {
      "if": {
        "properties": {
          "status": {
            "enum": [
              "FAILED",
              "BLOCKED"
            ]
          }
        },
        "required": [
          "status"
        ]
      },
      "then": {
        "properties": {
          "errors": {
            "minItems": 1
          }
        }
      }
    }
  ]
}
